{
  "schema_version": "0.1.0",
  "update_id": "RUP-000189",
  "topic_id": "CROSS-15",
  "created_at": "2026-09-02T07:28:20+09:00",
  "base_commit": "6e7a783e5d00998d7d24ae329d1b9b38043b144e",
  "predecessor_updates": [
    {"update_id": "RUP-000149", "bundle_sha256": "38c515527de3ad41dd99cc6f4d92dffd531ea10baf65bbe80062a50b66467ab4"},
    {"update_id": "RUP-000152", "bundle_sha256": "6533a74e7ef360f620682defed32b63c5cd443a96bec0abd16ffee8fd3dc3adc"},
    {"update_id": "RUP-000155", "bundle_sha256": "d1533f99e7ad6decc467facc8a075872292534688667391754888699fe08ff51"},
    {"update_id": "RUP-000162", "bundle_sha256": "8244815c2c0f1a8218defa4810708ef51bdf0f64cf61057ca397ab46d5bc25d9"},
    {"update_id": "RUP-000165", "bundle_sha256": "6845544780cf6c8b7bedc9fba2d3b5510a916afe6b7e71942087f9f8184b2153"},
    {"update_id": "RUP-000168", "bundle_sha256": "c0a1ef20a7e662302704e737048e20b945196ec9c38241844cbb38da26dd7178"}
  ],
  "before_profile_sha256": "cd57e07379eb8efd56b4b4f00991ed60b5c8055db8041aaa6e03a9fbad35ffa0",
  "human_directive_id": "DIR-900021",
  "research_status": "provisional",
  "consensus_status": "incomplete",
  "execution": {
    "mode": "interactive-human-authorized",
    "agent_count": 1,
    "model_count": 1,
    "provider": "OpenAI",
    "model_identity": "Codex; exact model/version not exposed in this execution",
    "security_profile_id": "SEC-PROFILE-REPOSITORY-ONLY",
    "retrieval_capability": "managed-web"
  },
  "summary_ja": "ABCI 3.0の公式料金表から、標準・政策割引と、バッチ・予約を別軸とする料金設計を追加しました。計算ノード1台当たり、標準バッチ3,300円/時、標準予約4,950円/時、開発加速バッチ1,650円/時、開発加速予約2,475円/時です。開発加速利用は目的、公開性、利用者・利用原資等の審査を伴い、予約は資源占有を提供します。単純な一律割引ではなく、政策適格性とサービス保証を別々に価格へ反映する実例です。Consensusは未完了です。",
  "summary_en": "The official ABCI 3.0 tariff adds a pricing design with separate axes for standard versus policy-discounted access and batch versus reservation service. Per compute node, published rates are JPY 3,300/hour standard batch, JPY 4,950/hour standard reservation, JPY 1,650/hour Development Acceleration batch, and JPY 2,475/hour Development Acceleration reservation. Development Acceleration Use is screened for purpose, openness, user, and funding attributes, while reservation provides resource occupancy. This is an operating example that prices policy eligibility separately from service guarantees rather than applying a single universal discount. Consensus is incomplete.",
  "units": [
    {
      "unit_id": "CROSS-15-U01",
      "before_sha256": "891a57aa832ba9f057947a4ab762d739eb1849a9be0c535128bfd405deaf63c7",
      "evidence_section_ids": ["TDS-CD1-CROSS-15-U01", "TDS-CD2-CROSS-15-U01", "TDS-CD3-CROSS-15-U01", "TDS-CD12-CROSS-15-U01", "TDS-CD14-CROSS-15-U01", "TDS-CD15-CROSS-15-U01", "TDS-CD16-CROSS-15-U01", "TDS-CD17-CROSS-15-U01", "TDS-CD18-CROSS-15-U01", "TDS-CD19-CROSS-15-ABCI3-TARIFF"]
    }
  ],
  "sections": [
    {
      "section_id": "TDS-CD19-CROSS-15-ABCI3-TARIFF",
      "title_ja": "ABCI 3.0は政策適格性とサービス保証を別々に価格化する",
      "title_en": "ABCI 3.0 prices policy eligibility separately from service guarantees",
      "summary_ja": "四つの料金を一つの割引率へ潰さず、利用目的の審査と資源予約の価値を分けて比較します。",
      "summary_en": "Keep four tariffs distinct so policy review and the value of reserved capacity can be compared separately.",
      "items": [
        {
          "item_id": "TDI-CD19-ABCI3-POLICY-DISCOUNT",
          "name_ja": "審査制の開発加速利用は標準利用の半額",
          "name_en": "Screened Development Acceleration Use is half the Standard Use price",
          "stage": "current",
          "maturity": "deployed",
          "timing_ja": "2025年度から二クラス制",
          "timing_en": "Two classes from FY2025",
          "statement_ja": "標準利用は市場価格を参考に設定し、基盤モデル、生成AI、マルチモーダルAI等の研究開発・評価・人材育成に重点提供する開発加速利用は半額です。後者は目的への合致、開発の公開性、利用者と利用原資の属性等を申請審査します。割引は設備調達時の値引きではなく、政策目的に基づく利用料金です。",
          "statement_en": "Standard Use references market pricing, while Development Acceleration Use for priority research, evaluation, and training in foundation models, generative AI, multimodal AI, and related work is half price. Eligibility is reviewed using purpose alignment, development openness, user attributes, and funding attributes. The discount is a policy-based user tariff, not evidence of a discount on equipment procurement.",
          "hpci_relevance_ja": "HPCIでも、原価回収と重点政策支援を同じ料金に混ぜず、適格条件、補助額、成果公開条件を明示できます。",
          "hpci_relevance_en": "HPCI can separate cost recovery from policy priority and state eligibility, subsidy, and output-disclosure conditions explicitly.",
          "adoption_conditions_ja": ["適格条件と審査過程を公開する。", "標準価格の市場参照方法と更新周期を示す。", "割引による需要増、待ち時間、成果、民間市場への影響を評価する。"],
          "adoption_conditions_en": ["Publish eligibility conditions and review process.", "State the market-reference method and update cycle for the standard tariff.", "Evaluate effects on demand, queue time, outcomes, and the commercial market."],
          "actor_ids": [],
          "source_ids": ["SRC-CDS236"],
          "confidence": "high",
          "consensus_status": "incomplete"
        },
        {
          "item_id": "TDI-CD19-ABCI3-BATCH-RESERVATION",
          "name_ja": "ベストエフォート型バッチと占有予約の価格差",
          "name_en": "Price difference between best-effort batch and reserved occupancy",
          "stage": "current",
          "maturity": "deployed",
          "timing_ja": "公表料金例は2024年度",
          "timing_en": "Published tariff example for FY2024",
          "statement_ja": "計算ノード1台当たりの公表例は、標準バッチ3,300円/時・予約4,950円/時、開発加速バッチ1,650円/時・予約2,475円/時です。バッチは混雑による待ちと継続時間制限があり、予約は資源を占有します。したがって差額は単なる優先度ではなく、開始時刻と継続利用の保証価値を含みます。",
          "statement_en": "Published rates per compute node are JPY 3,300/hour standard batch and JPY 4,950/hour standard reservation, versus JPY 1,650/hour accelerated batch and JPY 2,475/hour accelerated reservation. Batch service can wait under congestion and limits continuous duration, whereas reservation occupies resources. The premium therefore includes start-time and continuous-use assurance rather than priority alone.",
          "hpci_relevance_ja": "長時間学習、実験連携、緊急計算には、計算量だけでなく開始期限と連続確保を料金・配分制度へ反映する必要があります。",
          "hpci_relevance_en": "Long training, experiment coupling, and urgent computing require allocation and pricing for start deadlines and continuous capacity, not compute quantity alone.",
          "adoption_conditions_ja": ["バッチ待ち時間、予約充足率、未使用予約、プリエンプションを計測する。", "緊急利用、実験予約、長時間学習の保証水準を定義する。", "保証水準別の原価と機会費用を示す。"],
          "adoption_conditions_en": ["Measure batch wait, reservation fulfillment, unused reservations, and preemption.", "Define service guarantees for emergency use, experiment reservations, and long training.", "State cost and opportunity cost by guarantee level."],
          "actor_ids": [],
          "source_ids": ["SRC-CDS236"],
          "confidence": "high",
          "consensus_status": "incomplete"
        }
      ]
    }
  ],
  "archive_section_ids": [],
  "source_checks": [
    {
      "source": {"source_id": "SRC-CDS236", "title": "ABCI 3.0で最先端の生成AIの技術開発と社会実装を加速", "publisher": "産業技術総合研究所", "url": "https://www.aist.go.jp/aist_j/news/announce/pr20241010.html", "source_class": "official-project", "published_or_updated": "2024-10-10"},
      "origin_group": "abci3-configuration-pricing",
      "checked_at": "2026-09-02T02:56:00+09:00",
      "locator": "ABCI 3.0の利用、標準利用・開発加速利用、バッチ・予約、時間単価",
      "observation_ja": "二つの政策クラス、二つの利用形態、四つの単価、審査条件、サービス差を確認しました。",
      "observation_en": "Verified two policy classes, two service modes, four rates, review conditions, and service differences.",
      "result": "read-primary-single-model"
    }
  ],
  "coverage_gaps": [],
  "remaining_work_ja": ["2025年度以降の最新単価、標準価格の市場参照方法、原価回収率、補助額、利用率、待ち時間、予約充足率は未確認です。", "料金差の効果を成果や民間市場への影響まで評価した公開データは未収集です。", "独立モデルによる一次資料確認とConsensusは未完了です。"],
  "remaining_work_en": ["Current post-FY2024 rates, the market-reference method, cost recovery, subsidy, utilization, queue time, and reservation fulfillment remain unverified.", "Public evidence evaluating effects on outcomes and the commercial market has not been collected.", "Independent-model primary-source review and Consensus remain incomplete."]
}
