{
  "schema_version": "0.1.0",
  "update_id": "RUP-000269",
  "topic_id": "APP-13",
  "created_at": "2026-09-02T07:41:40+09:00",
  "base_commit": "6e7a783e5d00998d7d24ae329d1b9b38043b144e",
  "predecessor_updates": [
    {
      "update_id": "RUP-000210",
      "bundle_sha256": "f15addd3693585f725953fb389f7396a71f83d486158b414e6875069f1b23ce1"
    },
    {
      "update_id": "RUP-000211",
      "bundle_sha256": "7dec8991ee83d030b07477ff7ae8307c97909c6ad719bf6b8ed505998b997677"
    },
    {
      "update_id": "RUP-000217",
      "bundle_sha256": "616a0ef9f5ecd4cb24486968d618c93623f1bdeab8f28bcf22e35706e3fad423"
    },
    {
      "update_id": "RUP-000220",
      "bundle_sha256": "136b6e2474588413dcfd97f44a407d3c8b6ff4b6e5a7b7e48784812eef969d42"
    },
    {
      "update_id": "RUP-000230",
      "bundle_sha256": "cd6fe39d3766d425c6060465fc5ea9220e9b36c7fae786ecb807c84837f8a362"
    }
  ],
  "before_profile_sha256": "97daa095d8aa6f2c20cd4808a37f89418e0af8e820df158aaa627aae77d6f7bc",
  "human_directive_id": "DIR-900021",
  "research_status": "provisional",
  "consensus_status": "incomplete",
  "execution": {
    "mode": "interactive-human-authorized",
    "agent_count": 1,
    "model_count": 1,
    "provider": "OpenAI",
    "model_identity": "Codex; exact model/version not exposed in this execution",
    "security_profile_id": "SEC-PROFILE-REPOSITORY-ONLY",
    "retrieval_capability": "managed-web"
  },
  "summary_ja": "JHPCN FY2025報告は、JUWELS Booster上のResNet-50分散学習でPyTorch DistributedDataParallelがHorovodより高い並列効率とデータスループットを示したと報告しています。ただし公開本文にはGPU数、バッチ、精度、時間、ネットワーク、ソフトウェア版、数値結果がなく、一般的な優劣やHPCI候補機の性能差には使えません。分散学習バックエンドは実際のモデルと構成で継続比較する必要があります。Consensusは未完了です。",
  "summary_en": "The FY2025 JHPCN report states that PyTorch DistributedDataParallel delivered higher parallel efficiency and data throughput than Horovod for ResNet-50 training on JUWELS Booster. The public text omits GPU count, batch size, accuracy, time, network, software versions, and numerical results, so it cannot establish general superiority or predict HPCI candidate performance. Distributed-training backends require recurring comparison on actual models and configurations. Consensus is incomplete.",
  "units": [
    {
      "unit_id": "APP-13-U01",
      "before_sha256": "37901fe9f62c198ef04803f85aa6778cb6ec1f57678653c061a62dd29384d2ef",
      "evidence_section_ids": [
        "TDS-AIP-EVALUATION",
        "TDS-HC26-APP-13-U1",
        "TDS-CD2-APP-13-U01",
        "TDS-CD19-APP-13-AI-BENCHMARK-LIFECYCLE",
        "TDS-CD23-APP-13-MLPERF-6",
        "TDS-CD36-APP-13-MLCOMMONS-SCIENCE-MATURITY",
        "TDS-CD37-APP-13-DDP-HOROVOD"
      ]
    }
  ],
  "sections": [
    {
      "section_id": "TDS-CD37-APP-13-DDP-HOROVOD",
      "title_ja": "JUWELS Booster上のDDP・Horovod比較",
      "title_en": "DDP-Horovod comparison on JUWELS Booster",
      "summary_ja": "フレームワーク名ではなく、モデル・規模・精度・通信条件を揃えて比較します。",
      "summary_en": "Compare matched model, scale, accuracy, and communication conditions rather than framework names.",
      "items": [
        {
          "item_id": "TDI-CD76-DDP-HOROVOD-RESNET50",
          "name_ja": "ResNet-50でDDPがHorovodを上回るとの報告",
          "name_en": "Reported DDP advantage over Horovod for ResNet-50",
          "stage": "current",
          "maturity": "prototype",
          "timing_ja": "FY2025実績を2026年最終報告",
          "timing_en": "FY2025 results in a 2026 final report",
          "statement_ja": "JUWELS Booster上のResNet-50分散学習について、PyTorch DistributedDataParallelがHorovodより高い並列効率とデータスループットを示し、大規模マルチGPU学習に適すると報告されています。本文は数値表と設定を示さないため、差の大きさ、統計的安定性、原因、他モデル・他ネットワークへの適用範囲を確定できません。",
          "statement_en": "For distributed ResNet-50 training on JUWELS Booster, the report states that PyTorch DistributedDataParallel achieved higher parallel efficiency and data throughput than Horovod and was preferred for large multi-GPU workloads. Without a numerical table or configuration, the magnitude, statistical stability, cause, and transferability to other models and networks cannot be established.",
          "hpci_relevance_ja": "調達時にはDDP、Horovod、ベンダー集合通信を、学習精度を保ったend-to-end時間、通信量、障害回復、保守性で比較する必要があります。",
          "hpci_relevance_en": "Procurement should compare DDP, Horovod, and vendor collectives by end-to-end time at matched accuracy, communication, recovery, and maintainability.",
          "adoption_conditions_ja": [
            "GPU数、モデル版、データ、global/local batch、optimizer、精度、epochを固定する。",
            "warm-up、通信、I/O、前処理、失敗・再開を含む時間を測る。",
            "単一要約を全モデル・全システムの順位に外挿しない。"
          ],
          "adoption_conditions_en": [
            "Pin GPU count, model and data versions, global/local batch, optimizer, accuracy, and epochs.",
            "Measure warm-up, communication, I/O, preprocessing, failure, and restart within end-to-end time.",
            "Do not extrapolate one summary to all models and systems."
          ],
          "actor_ids": [],
          "source_ids": [
            "SRC-CDS340"
          ],
          "confidence": "high",
          "consensus_status": "incomplete"
        }
      ]
    }
  ],
  "archive_section_ids": [],
  "source_checks": [
    {
      "source": {
        "source_id": "SRC-CDS340",
        "title": "Final Report for JHPCN Joint Research of FY 2025: Innovative Computational Science by Integration of Simulation/Data/Learning on Heterogeneous Supercomputers",
        "publisher": "Joint Usage/Research Center for Interdisciplinary Large-scale Information Infrastructures (JHPCN)",
        "url": "https://jhpcn-kyoten.itc.u-tokyo.ac.jp/download/final/jh250027.pdf",
        "source_class": "official-project",
        "published_or_updated": "2026"
      },
      "origin_group": "jhpcn-fy2025-sdl-final-report",
      "checked_at": "2026-09-02T05:49:00+09:00",
      "locator": "Page 5: ResNet-50 distributed training comparison of PyTorch DDP and Horovod on JUWELS Booster",
      "observation_ja": "JUWELS Booster上のResNet-50でDDPがHorovodより高い並列効率・データスループットとの記述を確認しました。",
      "observation_en": "Verified the report's statement that DDP had higher parallel efficiency and data throughput than Horovod for ResNet-50 on JUWELS Booster.",
      "result": "read-primary-single-model"
    }
  ],
  "coverage_gaps": [],
  "remaining_work_ja": [
    "GPU数、バッチ、精度、時間、帯域、版、反復、数値結果は公開本文から確認できません。",
    "独立モデルによるConsensusは未完了です。"
  ],
  "remaining_work_en": [
    "GPU count, batch, accuracy, time, bandwidth, versions, repetitions, and numerical results are unavailable from the public text.",
    "Independent-model Consensus remains incomplete."
  ]
}
