{
  "schema_version": "0.1.0",
  "update_id": "RUP-000030",
  "topic_id": "ARCH-05",
  "created_at": "2026-08-31T22:26:10+09:00",
  "base_commit": "60691c3ae26e993ca57d6bb020b1571706ac7b65",
  "before_profile_sha256": "03b3aaa978de4402620bbd295693882d1763472d8e4befdf908988867718544d",
  "human_directive_id": "DIR-900018",
  "research_status": "provisional",
  "consensus_status": "incomplete",
  "execution": {
    "mode": "interactive-human-authorized",
    "agent_count": 1,
    "model_count": 1,
    "provider": "OpenAI",
    "model_identity": "Codex; exact model/version not exposed in this execution",
    "security_profile_id": "SEC-PROFILE-REPOSITORY-ONLY",
    "retrieval_capability": "managed-web"
  },
  "summary_ja": "ノード・ラック・システムを、通信・I/O、電力・冷却、提供形態、運用条件に分けて比較します。製品の生産移行とラックの出荷・供用開始を区別し、公開構成の不整合は未確認事項として維持します。単一モデルによる暫定結果です。",
  "summary_en": "Compare nodes, racks and systems by communication/I/O, power/cooling, delivery model and operating conditions. Separate product production ramps from rack shipments and service starts; retain inconsistent public specifications as gaps. Results remain provisional and single-model.",
  "units": [
    {
      "unit_id": "ARCH-05-U01",
      "before_sha256": "e47ce331307e1f087849ffe9679de88ec2503a895f62f1e77b47cd3ae5d0b03f",
      "evidence_section_ids": [
        "TDS-HW1-ARCH-05-U01",
        "TDS-HW2-ARCH-05-U01"
      ]
    }
  ],
  "sections": [
    {
      "section_id": "TDS-HW2-ARCH-05-U01",
      "title_ja": "Vera Rubin: 生産・出荷・供用の区別",
      "title_en": "Vera Rubin: distinguish production, shipment and service",
      "summary_ja": "ラック構成に必要な部品と、実際に利用できるシステムの時期を分けて追跡します。",
      "summary_en": "Track component readiness separately from usable-system availability.",
      "items": [
        {
          "item_id": "TDI-HW2-RUBIN-DELIVERY",
          "stage": "near-term",
          "maturity": "announced",
          "source_ids": [
            "SRC-NET010"
          ],
          "actor_ids": [
            "ACT-NVIDIA"
          ],
          "confidence": "medium",
          "consensus_status": "incomplete",
          "name_ja": "Vera Rubin: 統合ラックと提供までの段階",
          "name_en": "Vera Rubin: integrated racks and delivery stages",
          "timing_ja": "2026年5月31日の量産移行発表。システム出荷は秋の予定。",
          "timing_en": "May 31, 2026 production-ramp announcement; system shipments planned for fall.",
          "statement_ja": "Vera、Rubin、NVLinkとネットワークを統合する構成です。量産への移行とシステムの秋の出荷予定を区別し、特定センターでの受入れ完了や一般利用開始とは扱いません。",
          "statement_en": "The platform integrates Vera, Rubin, NVLink and networking. Distinguish the production ramp from planned fall system shipments; neither establishes acceptance or service start at a particular center.",
          "hpci_relevance_ja": "メモリ、NIC・スイッチ、ドライバ、冷却、受入試験の準備が揃って初めて導入可能です。部品ごとの公表日を足し合わせて稼働日を決めません。",
          "hpci_relevance_en": "Deployment requires memory, NICs/switches, drivers, cooling and acceptance tests to be ready together. Component announcement dates do not determine a system service date.",
          "adoption_conditions_ja": [
            "OEM構成別の出荷、施設適合、ソフトウェア認定、受入記録"
          ],
          "adoption_conditions_en": [
            "OEM-specific shipment, facility fit, software qualification and acceptance records"
          ]
        }
      ]
    }
  ],
  "archive_section_ids": [],
  "source_checks": [
    {
      "source": {
        "source_id": "SRC-NET010",
        "title": "NVIDIA Vera Rubin Ramps Into Full Production to Power Agentic AI Factories Worldwide",
        "publisher": "NVIDIA",
        "url": "https://nvidianews.nvidia.com/news/vera-rubin-full-production-agentic-ai-factory",
        "source_class": "official-vendor",
        "published_or_updated": "2026-05-31"
      },
      "origin_group": "nvidia-vera-rubin-may2026",
      "checked_at": "2026-08-31T21:47:34+09:00",
      "locator": "Building the Fabric; Availability",
      "observation_ja": "Spectrum-X Photonics生産と、Vera Rubinの秋の出荷予定を区別。5倍効率等はメーカー主張で同条件の独立実測ではない。",
      "observation_en": "Distinguished Spectrum-X Photonics production from planned fall Vera Rubin shipments; efficiency multiples are vendor claims, not matched independent measurements.",
      "result": "read-primary-single-model"
    }
  ],
  "coverage_gaps": [],
  "remaining_work_ja": [
    "OEM別の出荷・利用開始と施設適合の確認",
    "公開構成の数値不整合、契約範囲、独立Consensus"
  ],
  "remaining_work_en": [
    "OEM-specific shipment/service starts and facility fit",
    "Public-configuration inconsistencies, contract boundaries and independent Consensus"
  ],
  "predecessor_updates": [
    {
      "update_id": "RUP-000025",
      "bundle_sha256": "ee4430c11113a415742663dc85885f4872aae0124b74eb1809c2da9bf3225f4d"
    }
  ]
}
