{
  "schema_version": "0.1.0",
  "update_id": "RUP-000217",
  "topic_id": "APP-13",
  "created_at": "2026-09-02T07:33:00+09:00",
  "base_commit": "6e7a783e5d00998d7d24ae329d1b9b38043b144e",
  "predecessor_updates": [
    {"update_id": "RUP-000210", "bundle_sha256": "f15addd3693585f725953fb389f7396a71f83d486158b414e6875069f1b23ce1"},
    {"update_id": "RUP-000211", "bundle_sha256": "7dec8991ee83d030b07477ff7ae8307c97909c6ad719bf6b8ed505998b997677"}
  ],
  "before_profile_sha256": "7e62f6581963b03ec540957a383ebf3cece2f01f021bb146b5d1b8c5a34c7b03",
  "human_directive_id": "DIR-900021",
  "research_status": "provisional",
  "consensus_status": "incomplete",
  "execution": {
    "mode": "interactive-human-authorized",
    "agent_count": 1,
    "model_count": 1,
    "provider": "OpenAI",
    "model_identity": "Codex; exact model/version not exposed in this execution",
    "security_profile_id": "SEC-PROFILE-REPOSITORY-ONLY",
    "retrieval_capability": "managed-web"
  },
  "summary_ja": "AIワークロードの評価について、MLPerf Training 6.0とInference 6.0の新しい公開結果を追加しました。Training 6.0はDeepSeek V3とGPT-OSS 20Bを加え、MoEの疎な演算、ルーティング、異なる規模を評価します。Inference 6.0はGPT-OSS 120B、DeepSeek-R1の対話シナリオ、VLM、text-to-video等を加え、最大72ノード・288アクセラレータの提出も含みます。品質しきい値を伴う比較として有用ですが、科学アプリケーション、センター運用、費用、電力、障害復旧を直接表すものではありません。既存のエージェント評価と併せ、用途別に評価セットを構成する必要があります。Consensusは未完了です。",
  "summary_en": "This update adds MLPerf Training 6.0 and Inference 6.0 results to AI-workload evaluation. Training 6.0 introduces DeepSeek V3 and GPT-OSS 20B to exercise sparse MoE computation, routing, and different scales. Inference 6.0 adds GPT-OSS 120B, an interactive DeepSeek-R1 scenario, VLM, text-to-video, and submissions as large as 72 nodes and 288 accelerators. These quality-constrained comparisons are useful, but they do not directly represent scientific applications, center operations, cost, energy, or failure recovery. HPCI needs workload-specific suites that combine them with agent and scientific evaluation. Consensus is incomplete.",
  "units": [
    {
      "unit_id": "APP-13-U01",
      "before_sha256": "a3fcd9545a91afb7c0ceb550389bb3d04eeab048f2aa37c4742a23810871fd86",
      "evidence_section_ids": [
        "TDS-AIP-EVALUATION",
        "TDS-HC26-APP-13-U1",
        "TDS-CD2-APP-13-U01",
        "TDS-CD19-APP-13-AI-BENCHMARK-LIFECYCLE",
        "TDS-CD23-APP-13-MLPERF-6"
      ]
    }
  ],
  "sections": [
    {
      "section_id": "TDS-CD23-APP-13-MLPERF-6",
      "title_ja": "MLPerf 6.0が示すMoE学習と大規模推論の評価範囲",
      "title_en": "MLPerf 6.0 coverage of MoE training and scaled inference",
      "summary_ja": "モデル品質を揃えた性能比較の対象と、HPCI向けに追加すべき評価範囲を分けます。",
      "summary_en": "Separate quality-constrained performance coverage from the additional evaluation scope required for HPCI.",
      "items": [
        {
          "item_id": "TDI-CD23-MLPERF-TRAINING-60",
          "name_ja": "Training 6.0は大小二つのMoE負荷を追加",
          "name_en": "Training 6.0 adds large and small MoE workloads",
          "stage": "current",
          "maturity": "standardized",
          "timing_ja": "2026年6月16日結果公開",
          "timing_en": "Results published June 16, 2026",
          "statement_ja": "MLPerf Training 6.0は、総6710億パラメータ・token当たり370億有効パラメータのDeepSeek V3と、総210億・有効36億のGPT-OSS 20Bを追加しました。後者は単一8 GPUノードから実行可能な入口として設計されています。24組織、95の異なるシステム、13種類のアクセラレータ、19種類のホストプロセッサが提出され、60%がマルチノードでした。結果は規定品質到達時間を比較しますが、学習データ準備、運用待機、障害、全消費電力、取得費用を一律には含みません。",
          "statement_en": "MLPerf Training 6.0 adds DeepSeek V3 with 671 billion total and 37 billion active parameters per token, and GPT-OSS 20B with 21 billion total and 3.6 billion active parameters. The latter is designed as an entry point that can run on a single eight-GPU node. The round includes 24 organizations, 95 unique systems, 13 accelerator types, 19 host-processor types, and 60% multi-node systems. Results compare time to a specified quality target, but do not uniformly include data preparation, queueing, failures, total facility energy, or acquisition cost.",
          "hpci_relevance_ja": "大規模基盤モデル用資源だけでなく、大学センターで導入可能な単一ノード級MoE評価を同じ枠組みで比較する候補になります。",
          "hpci_relevance_en": "It provides a candidate framework for comparing both large foundation-model systems and single-node-scale MoE systems accessible to university centers.",
          "adoption_conditions_ja": [
            "品質しきい値、ルール、参照実装、提出区分、ソフトウェア版を固定する。",
            "学習データ準備、チェックポイント、再開、ネットワーク、電力を別計測として追加する。",
            "提出のない国内候補システムは同じルールで再実行し、公開提出値から推定しない。"
          ],
          "adoption_conditions_en": [
            "Pin quality targets, rules, reference implementations, submission divisions, and software versions.",
            "Add separate measurements for data preparation, checkpointing, restart, networking, and energy.",
            "Run unsubmitted domestic candidate systems under the same rules rather than extrapolating from public submissions."
          ],
          "actor_ids": [],
          "source_ids": ["SRC-CDS292"],
          "confidence": "high",
          "consensus_status": "incomplete"
        },
        {
          "item_id": "TDI-CD23-MLPERF-INFERENCE-60",
          "name_ja": "Inference 6.0は推論負荷とマルチノード範囲を拡張",
          "name_en": "Inference 6.0 expands inference workloads and multi-node scale",
          "stage": "current",
          "maturity": "standardized",
          "timing_ja": "2026年4月1日結果公開",
          "timing_en": "Results published April 1, 2026",
          "statement_ja": "MLPerf Inference 6.0はデータセンター向け11試験のうち5試験を新設・更新し、GPT-OSS 120B、投機的デコーディングを認めるDeepSeek-R1対話シナリオ、DLRMv3、text-to-video、VLMを含めました。24組織が提出し、マルチノード提出は前回比30%増、10ノード超が全提出の10%、最大構成は72ノード・288アクセラレータでした。異なるシナリオのスループットや遅延は直接合算できません。",
          "statement_en": "MLPerf Inference 6.0 introduces or updates five of eleven datacenter tests, including GPT-OSS 120B, an interactive DeepSeek-R1 scenario that permits speculative decoding, DLRMv3, text-to-video, and VLM. Twenty-four organizations submitted results; multi-node submissions increased by 30% from the previous round, 10% of systems used more than ten nodes, and the largest used 72 nodes and 288 accelerators. Throughput and latency from different scenarios cannot be directly combined.",
          "hpci_relevance_ja": "科学推論・コーディングに近いLLM負荷と大規模推論構成を追跡できますが、科学的正しさやHPCI共用時の公平性は別評価が必要です。",
          "hpci_relevance_en": "It tracks LLM workloads related to scientific reasoning and coding and scaled inference systems, while scientific correctness and fairness under shared HPCI operation require separate evaluation.",
          "adoption_conditions_ja": [
            "server、offline、interactive等のシナリオと品質条件を混在させない。",
            "warm/cold cache、入力長・出力長、モデル精度、投機的デコーディング条件を記録する。",
            "HPCI向けには複数利用者、待機時間、失敗時再実行、電力・費用を追加する。"
          ],
          "adoption_conditions_en": [
            "Do not mix server, offline, interactive, or other scenarios and quality conditions.",
            "Record warm versus cold cache, input and output lengths, model precision, and speculative-decoding conditions.",
            "For HPCI, add multi-tenancy, queue time, failure retries, energy, and cost."
          ],
          "actor_ids": [],
          "source_ids": ["SRC-CDS293"],
          "confidence": "high",
          "consensus_status": "incomplete"
        }
      ]
    }
  ],
  "archive_section_ids": [],
  "source_checks": [
    {
      "source": {
        "source_id": "SRC-CDS292",
        "title": "MLPerf Training v6.0 Results: New MoE Benchmarks and Record System Diversity",
        "publisher": "MLCommons",
        "url": "https://mlcommons.org/2026/06/mlperf-training-v6-0-results/",
        "source_class": "official-project",
        "published_or_updated": "2026-06-16"
      },
      "origin_group": "mlperf-training-60",
      "checked_at": "2026-09-02T03:43:00+09:00",
      "locator": "new benchmarks, system diversity, and participation sections",
      "observation_ja": "DeepSeek V3・GPT-OSS 20Bの規模、提出組織・システム・アクセラレータ・ホストCPU・マルチノード比率を確認しました。",
      "observation_en": "Verified DeepSeek V3 and GPT-OSS 20B scales and the counts of organizations, systems, accelerators, host processors, and multi-node submissions.",
      "result": "read-primary-single-model"
    },
    {
      "source": {
        "source_id": "SRC-CDS293",
        "title": "MLPerf Inference v6.0 Benchmark Results",
        "publisher": "MLCommons",
        "url": "https://mlcommons.org/2026/04/mlperf-inference-v6-0-results/",
        "source_class": "official-project",
        "published_or_updated": "2026-04-01"
      },
      "origin_group": "mlperf-inference-60",
      "checked_at": "2026-09-02T03:44:00+09:00",
      "locator": "benchmark additions, participation, and multi-node-system sections",
      "observation_ja": "新規・更新負荷、参加組織数、マルチノード提出の増加、最大構成を確認しました。",
      "observation_en": "Verified new and updated workloads, organization count, growth in multi-node submissions, and the largest submitted configuration.",
      "result": "read-primary-single-model"
    }
  ],
  "coverage_gaps": [],
  "remaining_work_ja": [
    "公開結果のうちHPCI候補に対応する構成を、電力・価格・ソフトウェア条件と結び付けた比較は未実施です。",
    "科学アプリケーションとAIエージェントを含むHPCI固有の品質評価セットは未確定です。",
    "独立モデルによるConsensusは未完了です。"
  ],
  "remaining_work_en": [
    "Public results have not yet been mapped to HPCI candidates with energy, price, and software conditions.",
    "An HPCI-specific quality suite covering scientific applications and AI agents remains undefined.",
    "Independent-model Consensus remains incomplete."
  ]
}
